Index,Original Category,keywords,Description,Assigned Category
349,Other,"['09 21 instructions', '21 instructions cable', 'addison office return', 'attached procedures parts', 'cable swap attached', 'cable tags ties', 'cables kccm module', 'cables need returned', 'completion date 09', 'data cables kccm', 'date 09 21', 'firmware update required', 'firmware usb shipped', 'included information printed', 'included parts kit', 'information printed instruction', 'instruction sheet included', 'instructions cable swap', 'kccm module srb', 'kit cables need', 'market required completion', 'module srb required', 'need returned turbo', 'office return label', 'package cable tags', 'parts firmware usb', 'parts kit cables', 'parts package cable', 'printed instruction sheet', 'procedures parts package', 'replacement data cables', 'required completion date', 'required firmware update', 'required parts firmware', 'returned turbo technicians', 'sheet included parts', 'shipped market required', 'srb required firmware', 'swap attached procedures', 'tags ties included', 'technicians addison office', 'ties included information', 'turbo technicians addison', 'update required parts', 'usb shipped market']","Replacement of data cables from the KCCM Module to SRB required. Firmware Update required as well. Parts and Firmware USB have been shipped to the Market. This has a required completion date of 6/09/21. Instructions for cable swap attached in procedures as well as with parts package. Cable tags and ties are not included, fill out information on printed instruction sheet included in parts kit. Cables will need to be returned to Turbo Technicians Addison office, return label",Menu Issue
402,Other,"['constant key press', 'detected service support', 'key press detected', 'oven says constant', 'press detected service', 'says constant key']","Oven says ""constant key press detected call service support",Constant Key Press
405,Other,"['closed intermittent issue', 'displays oven door', 'door closed intermittent', 'door open error', 'error door closed', 'intermittent issue starting', 'issue starting appear', 'left oven displays', 'open error door', 'oven displays oven', 'oven door open']","Left side oven displays ""oven door open"" error even though the door is closed. It is an intermittent issue and is starting to appear more often.",Close Door Error
409,Other,"['display jolted inside', 'door sensitive door', 'door slams easily', 'fine display jolted', 'inside oven door', 'jolted inside oven', 'oven door sensitive', 'oven works fine', 'sensitive door slams', 'slams easily jolted', 'works fine display']","Oven works fine, but the display jolted inside. Oven door seems to be more sensitive than the other door in that it slams easily which is why it may have jolted around.",Close Door Error
411,Other,"['oven touch screen', 'screen slow respond', 'touch screen slow']",Oven touch screen slow to respond,Display Issue
419,Other,"['got unscrewed inside', 'handle got unscrewed', 'like handle got']",It seems like handle got unscrewed somehow from the inside.,Broken Door Handle
420,Other,"['calling store unolug', 'constant key press', 'error treid calling', 'key press error', 'press error treid', 'store unolug answer', 'treid calling store', 'unolug answer 9513717275']",CONSTANT KEY PRESS ERROR TREID CALLING STORE TO HAVE THEM UNOLUG NO ANSWER 9513717275,Constant Key Press
423,Other,"['believe missing screw', 'missing screw needs', 'needs fixed asap', 'screw needs fixed']",I believe its missing a screw needs to be fixed asap,Door
453,Other,"['constant key press', 'detected service support', 'key press detected', 'press detected service', 'service support message', 'warning constant key']","""warning constant key press detected - call service support"" message",Constant Key Press
455,Other,"['constant key press', 'detected service support', 'display reads warning', 'key press detected', 'press detected service', 'reads warning constant', 'warning constant key']",Display reads: warning constant key press detected & call service support,Constant Key Press
468,Other,"['display working screen', 'screen requested service', 'working screen requested']",Display not working screen requested service,Constant Key Press
492,Other,[],Electrocuted partner,Unknown
498,Other,"['burning partners left', 'casing intake fan', 'damaged casing intake', 'fan burning partners', 'intake fan burning', 'partners left oven']",Damaged casing and intake fan. It is burning partners. Left oven.,Door
505,Other,"['burned didnt opened', 'completely burned didnt', 'didnt opened oven', 'door edge tray', 'edge tray little', 'leg look pretty', 'little leg look', 'look pretty damaged', 'opened oven door', 'oven door edge', 'papers completely burned', 'tray little leg', 'warming papers completely']",One of the warming papers completely burned. I didnt see a fire when i opened the oven door. The edge of the tray and little leg look pretty damaged.,Tray/Peg Issue
525,Other,"['00 remove loaned', '10 700 install', '700 install 90', '790 00 remove', '90 disposal total', 'arrival complete install', 'arrival date 10', 'blower sn ngod13790', 'comments new oven', 'complete install job', 'completion comments new', 'date 10 700', 'disposal total po', 'dispose offsite old', 'dual merrychef oven', 'good new oven', 'guardian serial tested', 'install 90 disposal', 'install job remove', 'install new merrychef', 'new oven serial', 'ngod13790 schedule store', 'number guardian serial', 'numbers installed photo', 'numbers removed serial', 'offsite old oven', 'old oven install', 'oven install new', 'oven placement required', 'oven replacement arrival', 'oven serial numb', 'oven serial number', 'ovens report serial', 'photo oven placement', 'placement required completion', 'po 790 00', 'remove dispose offsite', 'remove loaned blower', 'removed serial numbers', 'replacement arrival date', 'report serial numbers', 'required completion comments', 'schedule store tech', 'serial number guardian', 'serial numbers installed', 'serial numbers removed', 'serial tested good', 'sn ngod13790 schedule', 'store tech arrival', 'tech arrival complete']","***DUAL MERRYCHEF Oven Replacement*** Arrival date 3/10 $700 for install, $90 for disposal Total PO 790.00 Remove loaned bottom blower on SN: NGOD13790  Please schedule w/ store before tech arrival to complete install Job: remove then dispose offsite old oven Install two new MERRYCHEF ovens Report back all serial numbers removed and serial numbers installed PHOTO OF OVEN PLACEMENT NOW REQUIRED! Completion Comments New Oven 1 Serial Number: Guardian Serial: Tested: GOOD New Oven 2 Serial Numb",Loose Door Handle
539,Other,['welbilt billing 26059485'],Welbilt billing 26059485,Shuts Off
543,Other,['welbilt billing 26513989'],Welbilt billing 26513989,Shuts Off
569,Other,"['constant key press', 'detected service support', 'key press detected', 'press detected service', 'warning constant key']",Warning....constant key press detected. Call service support,Constant Key Press
574,Other,"['constant key press', 'detected error message', 'error message photo', 'key press detected', 'press detected error']",*constant key press detected See error message photo below.,Constant Key Press
575,Other,"['10374 kastor shift', 'accessible partners turned', 'ago trbl shooting', 'believes oven caught', 'called partner says', 'caught days ago', 'compartment food goes', 'days ago trbl', 'dept called partner', 'extinguisher partner says', 'food goes accessible', 'goes accessible partners', 'hours 10 pm', 'kastor shift right', 'oven caught days', 'oven safety dept', 'oven use extinguisher', 'partner says believes', 'partner says compartment', 'partners turned oven', 'right oven use', 'safety dept called', 'says believes oven', 'says compartment food', 'shift right oven', 'shooting store hours', 'store 10374 kastor', 'store hours 10', 'trbl shooting store', 'turned oven safety', 'use extinguisher partner']","Store# 10374, Kastor, shift, in a fire in the right oven, had to use the fire extinguisher. The partner says the fire was behind the compartment where food goes not accessible. The partners have turned the oven off for safety. Fire dept. was not called. Partner says she believes this oven caught on fire a few days ago as well. No trbl shooting. Store hours: 5 am - 10 pm.",Loose Door Handle
578,Other,"['10pm tried reset', '1456 sh 5am', '5am 10pm tried', 'alex shift merrychef', 'appeared kba merrychef', 'appeared tried hard', 'constant key press', 'e2s ovens 1456', 'error appeared kba', 'error appeared tried', 'error tried soft', 'giving constant key', 'hard reset error', 'kba merrychef e2s', 'key press error', 'merrychef e2s ovens', 'merrychef oven giving', 'oven error came', 'oven giving constant', 'ovens 1456 sh', 'press error tried', 'reset error appeared', 'reset oven error', 'sh 5am 10pm', 'shift merrychef oven', 'soft reset error', 'tried hard reset', 'tried reset oven', 'tried soft reset']","Alex SHIFT, Merrychef oven is giving a constant key press error Tried a soft reset, error still appeared Tried a hard reset and the error still appeared KBA: Merrychef E2S Ovens - 1456 SH: 5AM - 10PM Tried to reset the oven but the error came back",Power Supply
593,Other,"['coating oven door', 'door appears melting', 'oven door appears']",Coating on oven door appears to be melting,Close Door Error
600,Other,"['constant key press', 'detected service support', 'key press detected', 'press detected service']",CONSTANT KEY PRESS DETECTED CALL SERVICE SUPPORT,Constant Key Press
601,Other,"['10 30pm oven', '30pm oven showing', '5am 10 30pm', '9932 shift shelby', 'constant key press', 'detected ve tried', 'hours 5am 10', 'key press detected', 'langrehr hours 5am', 'message saying constant', 'oven showing message', 'press detected ve', 'saying constant key', 'shelby langrehr hours', 'shift shelby langrehr', 'showing message saying', 'store 9932 shift', 'tried turn shows', 'turn shows message', 've tried turn']","Store 9932 Shift: Shelby Langrehr Hours: 5am - 10:30pm Oven is showing a message saying ""constant key press detected"" we've tried to turn it on and off but it still shows the message.",Constant Key Press
605,Other,"['05 09 se', '08 08 spr', '08 spr https', '09 se 2022', '10 30p ovens', '12 12 sr', '12 sr st', '2019 12 12', '2022 05 09', '2022 08 08', '202205100419 7531b4cf d257', '2fx202h21hwalevoqkpuskxvi9awywwf47kw2s 2bk7lcy 3d', '30p ovens inconsistent', '4b7be9822dda jpeg sv', '5a 10 30p', '7531b4cf d257 4868', '88aa 4b7be9822dda jpeg', '9932 202205100419 7531b4cf', '9932 9932 202205100419', '9932 shift shelby', 'blob core windows', 'food properly warming', 'food wasn warm', 'heating time food', 'hours 5a 10', 'https s00332safocwpr blob', 'https sp sig', 'inconsistent heating time', 'jpeg sv 2019', 'langrehr hours 5a', 'net stores 9932', 'ovens inconsistent heating', 'properly warming customers', 's00332safocwpr blob core', 'said food wasn', 'se 2022 08', 'shelby langrehr hours', 'shift shelby langrehr', 'sig 2fx202h21hwalevoqkpuskxvi9awywwf47kw2s 2bk7lcy', 'sp sig 2fx202h21hwalevoqkpuskxvi9awywwf47kw2s', 'spr https sp', 'sr st 2022', 'st 2022 05', 'store 9932 shift', 'stores 9932 9932', 'sv 2019 12', 'time food properly', 'warm https s00332safocwpr', 'warming customers said', 'wasn warm https']",Store #: 9932 Shift: Shelby Langrehr Hours: 5a - 10:30p Both the ovens have an inconsistent heating time. The food is not properly warming up and customers have said their food wasn't warm enough. https://s00332safocwpr.blob.core.windows.net/stores/9932/9932-202205100419-7531B4CF-D257-4868-88AA-4B7BE9822DDA.jpeg?sv=2019-12-12&sr=b&st=2022-05-09&se=2022-08-08&spr=https&sp=r&sig=%2FX202H21hwaleVoQkpusKxvI9AwYwwF47KW2S%2BK7LcY%3D,Not Warming
621,Other,"['constant key press', 'oven constant key', 'screen working turn', 'touch screen working', 'turn oven constant', 'working turn oven']",Touch screen is not working. Also can not turn off oven. constant key press,Constant Key Press
622,Other,"['displaying error message', 'error message touch', 'message touch screen', 'touch screen photo']",Displaying error message on touch screen. See photo,116 Heater OFF on Request
658,Other,"['anytime food start', 'current goes anytime', 'electric current goes', 'food start cooking', 'goes anytime food', 'kind like electric', 'like electric current', 'oven spark sounds', 'sounds kind like', 'spark sounds kind']","In the back of the oven, there is a spark that sounds kind of like an electric current. It goes off anytime you put food in there and start cooking it.",Foul Odor
668,Other,"['2201213091548 merrychef e2s', '5520 oven saying', 'did work serial', 'e2s ovens issues', 'edgar ss 5520', 'issues kb0012272 sh', 'kb0012272 sh 4am', 'merrychef e2s ovens', 'number 2201213091548 merrychef', 'oven did work', 'oven saying pressed', 'ovens issues kb0012272', 'partner tried turning', 'pressed times partner', 'saying pressed times', 'serial number 2201213091548', 'sh 4am 7pm', 'ss 5520 oven', 'times partner tried', 'tried turning oven', 'turning oven did', 'work serial number']","edgar SS, 5520 oven is saying it was pressed too many times.partner tried turning oven on and off but it did not work. serial number-2201213091548 Merrychef E2S Ovens - All Issues KB0012272 sh-4am-7pm",Power Supply
701,Other,"['backwards hard tap', 'hard tap select', 'pushing backwards hard', 'screen pushing backwards']","Screen pushing backwards, hard to tap/ select",Constant Key Press
704,Other,"['calibrated ve needing', 'center order make', 'isn calibrated ve', 'make selection want', 'needing press center', 'order make selection', 'press button misalignment', 'press center order', 'screen isn calibrated', 'selection want press', 've needing press', 'want press button']","Screen isn't calibrated, so we've been needing to press off center in order to make the selection that we want. We can't press the back button because of the misalignment.",Control
744,Other,"['burn oven plate', 'causing indents burn', 'causing oven plate', 'damaged issue submitted', 'flattening causing indents', 'got new plates', 'indents burn oven', 'inside oven flattening', 'issue submitted tickets', 'just got new', 'new plates damaged', 'oven flattening causing', 'oven plate causing', 'oven plate wobble', 'pegs inside oven', 'plate causing oven', 'plate wobble just', 'plates damaged issue', 'submitted tickets issue', 'tickets issue ovens', 'wobble just got']","Some of the pegs inside the oven are flattening out on top, causing indents to burn into the bottom of the oven plate and causing the oven plate to wobble. Just got new plates and they are already becoming damaged due to this issue. Submitted two tickets because this is an issue with both ovens.",Cavity
